id|name|abbreviation|description|image_url|links|military_department|dormitory|city_id|created_at|updated_at|relap_image_url
62|Научно Исследовательский Институт – Высшая Школа Экономики|НИУ-ВШЭ|экономический вуз|http://hse.ru/image|{http://hse.ru/1,http://hse.ru/2}|t|f|2|2017-03-15 12:46:35.010184+03|2017-03-15 12:46:35.010184+03|http://hse.ru/image_relap
63|Российский экономический университет им. Г.В. Плеханова|РЭУ им. Г.В. Плеханова|вуз на серпуховской вроде бы|||t|t|2|2017-03-15 12:46:35.010184+03|2017-03-15 12:46:35.010184+03|
64|Санкт-Петербургский государственный университет|СПбГУ|Петербург! По барам!|||t|t|3|2017-03-15 12:46:35.010184+03|2017-03-15 12:46:35.010184+03|
65|Московский гуманитарный университет|МосГУ|платно и в выхино|||f|t|2|2017-03-15 12:46:35.010184+03|2017-03-15 12:46:35.010184+03|
66|Российская академия народного хозяйства и государственной службы при Президенте РФ|РАНХиГС|"Академия в нынешнем виде создана в 2010 году, но история у нее уже громадная. Еще в 1921 г. Ленин подписал постановление о создании Института по подготовке красной профессуры. Затем были Высшая школа марксизма-ленинизма, Академия общественных наук, Российская академия управления, Российская академия государственной службы (РАГС). А в 2010 году РАГС указом Президента РФ присоединили к Академии народного хозяйства (АНХ). АНХ, ранее - Институт управления народным хозяйством, ведет свою историю с 1970 г. 
В 2010 г. образовалась новая, теперь уже самая большая в России Академия - РАНХиГС. У нее 4 основных направления деятельности: высшее образование, подготовка госслужащих, бизнес-образование и научных консалтинг. Сейчас по стране действует 61 филиал Президентской академии. В связи с этим хотим отметить первый существенный минус – много филиалов. Вы сами прекрасно понимаете, что образование в Якутске в Президентской академии и в Москве – 2 разные вещи, а диплом по сути тот же. Далее, речь пойдет ТОЛЬКО о московском РАНХиГС. "||{http://www.ranepa.ru}|t|f|2|2017-03-15 12:46:35.010184+03|2017-03-15 12:46:35.010184+03|http://vuz.edunetwork.ru/files/3057/logo.jpg
67|Российский университет дружбы народов |РУДН|"Университет дружбы народов был основан 5 февраля 1960 года решением Правительства СССР. 22 февраля 1961 года Университету было присвоено  имя Патриса Лумумбы – одного из символов борьбы народов Африки за независимость. 
Первым ректором Университета был Сергей Васильевич Румянцев, Заслуженный деятель науки и техники РСФСР, доктор технических наук, профессор. При его непосредственном участии был организован Университет, которым С.В. Румянцев руководил с 1960 по 1970 год."|http://www.rudn.ru/image/1.jpg?2|{http://www.rudn.ru}||t|2|2017-03-15 12:46:35.010184+03|2017-03-15 12:46:35.010184+03|
